{
  "schema_version": "1.0",
  "release_version": "1.0.0-beta.1",
  "release_scope": "engineering_beta",
  "status": "blocked",
  "generated_at": "2026-07-28T07:00:00Z",
  "source": {
    "git_commit": "903e6b5616a9559a406986c7be96bc933f58ba3a",
    "worktree_dirty": true,
    "source_content_hash": "sha256:cccccccccccccccccccccccccccccccccccccccccccccccccccccccccccccccc",
    "version_files": [
      "package.json",
      "apps/web/package.json",
      "packages/parameter-engine/package.json",
      "src/Zhaojian.Api/Zhaojian.Api.csproj"
    ]
  },
  "deployment": {
    "mode": "single_instance",
    "database": "sqlite",
    "task_queue": "in_process_channel",
    "quota_store": "in_memory",
    "image_store": "sqlite_blob",
    "multi_instance_ready": false
  },
  "commands": [
    {
      "id": "skill_validate",
      "command": "npm run skill:validate",
      "status": "passed",
      "exit_code": 0,
      "duration_ms": 1000,
      "log_path": ".local/beta-release/1.0.0-beta.1/logs/skill_validate.log"
    },
    {
      "id": "mock_full60",
      "command": "npm run skill:train:mock -- --output-dir .local/beta-release/1.0.0-beta.1/mock-training --run-id beta_mock_full60_1_0_0-beta_1",
      "status": "passed",
      "exit_code": 0,
      "duration_ms": 4000,
      "log_path": ".local/beta-release/1.0.0-beta.1/logs/mock_full60.log"
    },
    {
      "id": "budget_cap_drill",
      "command": "npx vitest run tests/skill-trainer.test.ts -t 预算租约",
      "status": "passed",
      "exit_code": 0,
      "duration_ms": 2000,
      "log_path": ".local/beta-release/1.0.0-beta.1/logs/budget_cap_drill.log"
    },
    {
      "id": "registry_rollback_kill_switch_drill",
      "command": "dotnet test Zhaojian.slnx --filter SkillRegistryTests",
      "status": "passed",
      "exit_code": 0,
      "duration_ms": 3000,
      "log_path": ".local/beta-release/1.0.0-beta.1/logs/registry_rollback_kill_switch_drill.log"
    },
    {
      "id": "account_data_lifecycle_drill",
      "command": "dotnet test Zhaojian.slnx --filter ApiIntegrationTests",
      "status": "passed",
      "exit_code": 0,
      "duration_ms": 3000,
      "log_path": ".local/beta-release/1.0.0-beta.1/logs/account_data_lifecycle_drill.log"
    },
    {
      "id": "offline_verify",
      "command": "npm run verify",
      "status": "passed",
      "exit_code": 0,
      "duration_ms": 30000,
      "log_path": ".local/beta-release/1.0.0-beta.1/logs/offline_verify.log"
    },
    {
      "id": "fixed_evaluation",
      "command": "npm run evaluate:fixed",
      "status": "passed",
      "exit_code": 0,
      "duration_ms": 2000,
      "log_path": ".local/beta-release/1.0.0-beta.1/logs/fixed_evaluation.log"
    },
    {
      "id": "skill_registry_audit",
      "command": "npm run skill:audit",
      "status": "passed",
      "exit_code": 0,
      "duration_ms": 1000,
      "log_path": ".local/beta-release/1.0.0-beta.1/logs/skill_registry_audit.log"
    },
    {
      "id": "release_publish",
      "command": "dotnet publish src/Zhaojian.Api/Zhaojian.Api.csproj -c Release",
      "status": "passed",
      "exit_code": 0,
      "duration_ms": 5000,
      "log_path": ".local/beta-release/1.0.0-beta.1/logs/release_publish.log"
    },
    {
      "id": "package_release",
      "command": "tar -czf .local/beta-release/1.0.0-beta.1/zhaojian-1.0.0-beta.1.tar.gz",
      "status": "passed",
      "exit_code": 0,
      "duration_ms": 1000,
      "log_path": ".local/beta-release/1.0.0-beta.1/logs/package_release.log"
    }
  ],
  "artifacts": [
    {
      "id": "release_bundle",
      "path": ".local/beta-release/1.0.0-beta.1/zhaojian-1.0.0-beta.1.tar.gz",
      "sha256": "sha256:aaaaaaaaaaaaaaaaaaaaaaaaaaaaaaaaaaaaaaaaaaaaaaaaaaaaaaaaaaaaaaaa",
      "bytes": 1024
    },
    {
      "id": "mock_full60_report",
      "path": ".local/beta-release/1.0.0-beta.1/mock-training/beta_mock_full60_1_0_0-beta_1/report.json",
      "sha256": "sha256:dddddddddddddddddddddddddddddddddddddddddddddddddddddddddddddddd",
      "bytes": 2048
    }
  ],
  "drills": [
    {
      "id": "budget_cap",
      "status": "passed",
      "evidence": "本地 Live Fixture 在费用租约耗尽后停止新调用并保留终态报告。"
    },
    {
      "id": "skill_rollback",
      "status": "passed",
      "evidence": "候选激活后可原子回滚，历史快照保持可读。"
    },
    {
      "id": "cloud_kill_switch",
      "status": "passed",
      "evidence": "云端 Skill 关闭后新分析关闭失败，本地账号数据仍可读取。"
    },
    {
      "id": "account_data_lifecycle",
      "status": "passed",
      "evidence": "导出、注销、图片留存、任务恢复和账号隔离由集成测试覆盖。"
    },
    {
      "id": "fixed_regression",
      "status": "passed",
      "evidence": "固定摄影场景回归继续验证不凑数、不评分、边界诚实停下和参数守界。"
    }
  ],
  "real_model_evaluation": {
    "status": "not_authorized",
    "report_path": null,
    "run_id": null,
    "provider": null,
    "model": null,
    "dataset_id": null,
    "dataset_version": null,
    "dataset_content_hash": null,
    "report_content_hash": null,
    "selection_content_hash": null,
    "selected_asset_count": 0,
    "provider_calls": 0,
    "successful_calls": 0,
    "failed_calls": 0,
    "repaired_calls": 0,
    "unresolved_failed_calls": 0,
    "uncertain_calls": 0,
    "recovered_uncertain_calls": 0,
    "unresolved_uncertain_calls": 0,
    "quarantined_assets": 0,
    "prompt_tokens": 0,
    "completion_tokens": 0,
    "estimated_cost_cny": 0,
    "average_latency_ms": 0,
    "max_latency_ms": 0,
    "metric_count": 0,
    "metrics_passed": false,
    "pricing_version": null,
    "prompt_version": null,
    "schema_version": null,
    "independence_level": null,
    "role_count": 0,
    "skill_snapshots": []
  },
  "manual_records": [
    {
      "id": "browser_core_loop",
      "status": "passed",
      "evidence": "本地 Mock 浏览器验收覆盖分析、反馈授权、CreativeIntent、摄影日记、历史兼容和重试。"
    },
    {
      "id": "public_store_launch",
      "status": "deferred",
      "evidence": "商店、备案、支付、真实设备矩阵和公开运营不属于工程 Beta，本证据不能替代公开发布 Go/No-Go。"
    }
  ],
  "gates": [
    {
      "id": "version_consistency",
      "status": "passed",
      "evidence": "根工程、Web、参数引擎与 API 版本均为 1.0.0-beta.1。"
    },
    {
      "id": "source_artifact_consistency",
      "status": "passed",
      "evidence": "制品内源码快照哈希与当前源码一致。"
    },
    {
      "id": "offline_engineering",
      "status": "passed",
      "evidence": "离线工程验证与运行演练通过。"
    },
    {
      "id": "runtime_drills",
      "status": "passed",
      "evidence": "预算、回滚、kill switch、数据生命周期和固定回归演练通过。"
    },
    {
      "id": "real_model_full60",
      "status": "blocked",
      "evidence": "尚未取得剩余 60 图真实模型评测预算授权。"
    },
    {
      "id": "single_instance_boundary",
      "status": "passed",
      "evidence": "工程 Beta 明确保持单实例部署边界。"
    }
  ],
  "known_limitations_path": "docs/06-operations/beta-1.0.0-beta.1-known-limitations.md",
  "content_hash": "sha256:bbbbbbbbbbbbbbbbbbbbbbbbbbbbbbbbbbbbbbbbbbbbbbbbbbbbbbbbbbbbbbbb"
}
